{
 "schema_version": 1,
 "generated_at": "2026-10-21T10:34:44+00:00",
 "generator": "forecast_update.py",
 "status": "FRESH",
 "age_hours": 0.0,
 "max_age_hours": 12,
 "fresh_until": "2026-10-21T22:34:41+00:00",
 "data_fetched_at": "2026-10-21T10:34:41+00:00",
 "carried_over_from": null,
 "last_attempt": {
  "at": "2026-10-21T10:34:44+00:00",
  "outcome": "OK",
  "reason": "tous les modèles FRESH"
 },
 "point": {
  "parcel_id": "39160000ZP0001",
  "commune": "Commenailles",
  "lat": 46.8039042,
  "lon": 5.450162,
  "timezone": "Europe/Paris",
  "source": "centroïde cadastral du module Sol / Hydrologie (IGN API Carto)"
 },
 "attribution": {
  "open_meteo": {
   "text": "Weather data by Open-Meteo.com",
   "url": "https://open-meteo.com/",
   "licence": "CC BY 4.0",
   "licence_url": "https://creativecommons.org/licenses/by/4.0/",
   "usage": "usage personnel non commercial, API gratuite sans clé"
  },
  "producers": [
   {
    "name": "Météo-France",
    "models": [
     "AROME France HD",
     "AROME France",
     "ARPEGE Europe"
    ],
    "licence": "Licence Ouverte / Open Licence Etalab 2.0"
   },
   {
    "name": "ECMWF",
    "models": [
     "IFS HRES 9 km",
     "IFS ENS 9 km Europe"
    ],
    "licence": "ECMWF open data, CC BY 4.0"
   },
   {
    "name": "Deutscher Wetterdienst (DWD)",
    "models": [
     "ICON-EU",
     "ICON Global",
     "ICON-EU-EPS"
    ],
    "licence": "DWD open data, attribution « Quelle : Deutscher Wetterdienst »"
   }
  ],
  "changes": "séries horaires agrégées par période locale ; aucune moyenne inter-modèles"
 },
 "conventions": {
  "timestamps": "UTC ISO 8601 ; requêtes Open-Meteo en GMT (timeformat=unixtime)",
  "local_periods": "journées et demi-journées Europe/Paris (zoneinfo) ; pas horaires T avec début < T ≤ fin ; une journée compte 23, 24 ou 25 pas",
  "half_days": {
   "MORNING": "06:00–12:00 Europe/Paris",
   "AFTERNOON": "12:00–18:00 Europe/Paris"
  },
  "hourly_semantics": "cumuls (precipitation, rain, snowfall, ET0) et rafales : heure précédant T ; autres : instant T",
  "completeness": "valeur publiée seulement si tous les pas de la période sont valides ; sinon null",
  "units": {
   "precipitation": "mm",
   "snowfall": "cm de neige fraîche (convention Open-Meteo : 7 cm ≈ 10 mm d'équivalent en eau, soit mm = cm / 0,7)",
   "temperature": "°C",
   "wind": "km/h",
   "relative_humidity": "%"
  },
  "quantiles": "interpolation linéaire entre membres triés (Hyndman & Fan type 7), par système d'ensemble",
  "probabilities": "membres valides dépassant le seuil / membres valides (≥ seuil ; gel : minimum < 0 °C)",
  "ensemble_members": "contrôle + perturbés ; jamais mélangés entre systèmes",
  "preceding_windows": "cumuls déterministes sur ]début − N h, début] ; heures passées = runs Open-Meteo antérieurs (past_days=3), pas des observations",
  "hours_since_rain": "depuis la fin du dernier pas ≥ 0.2 mm ; lower_bound=true : aucun pas pluvieux dans la série, valeur minimale",
  "null": "valeur non calculable (hors horizon, pas manquant, variable non fournie)",
  "zero": "valeur prévue nulle",
  "freshness": "FRESH si âge ≤ 12 h depuis data_fetched_at, sinon STALE ; recalculer depuis data_fetched_at au moment de la lecture",
  "cache_ttl_hours": 2.0,
  "no_cross_model_average": true,
  "precipitation_thresholds_mm": {
   "prob_ge_0_5mm": 0.5,
   "prob_ge_2mm": 2.0,
   "prob_ge_5mm": 5.0,
   "prob_ge_10mm": 10.0
  },
  "gust_thresholds_kmh": {
   "prob_gust_ge_40kmh": 40.0,
   "prob_gust_ge_60kmh": 60.0
  },
  "confidence_rules": {
   "categories_mm": {
    "DRY": "< 0.5",
    "LIGHT": "0.5 à < 2.0",
    "WET": "2.0 à < 10.0",
    "VERY_WET": ">= 10.0"
   },
   "scenario_threshold_mm": 2.0,
   "min_models_high": 3,
   "agreement_high_min": 0.75,
   "agreement_low_below": 0.6,
   "ensemble_strong_wet": 0.7,
   "ensemble_strong_dry": 0.3,
   "ensemble_ambiguous": [
    0.4,
    0.6
   ],
   "ensemble_min_member_fraction": 0.8,
   "spread_notable_mm": 5.0,
   "spread_extreme_mm": 10.0,
   "spread_extreme_ratio": 3.0,
   "long_lead_day": 6,
   "high_res_models": [
    "arome_hd",
    "arome"
   ],
   "high_res_weight": 1.5,
   "high_res_max_lead_day": 2,
   "relays": {
    "icon_global": "icon"
   },
   "principle": "niveau initial HIGH, chaque règle ne peut que plafonner ; raisons publiées"
  }
 },
 "providers": {
  "deterministic": {
   "arome_hd": {
    "provider": "Météo-France",
    "model_name": "AROME France HD",
    "model_id": "meteofrance_arome_france_hd",
    "kind": "deterministic",
    "endpoint": "https://api.open-meteo.com/v1/forecast",
    "region": "France",
    "nominal_resolution_km": 1.5,
    "role": "très court terme J0–J2, poids interprétatif renforcé",
    "forecast_horizon": {
     "nominal_hours": 48,
     "observed_hours_after_fetch": 43.4,
     "last_complete_local_day": "2026-10-22"
    },
    "fetched_at": "2026-10-21T10:34:41+00:00",
    "from_cache": false,
    "status": "FRESH",
    "status_reason": "horizon observé 43 h après la collecte ; non fournies par ce modèle : rain, snowfall, et0_fao_evapotranspiration, surface_temperature",
    "first_forecast_time": "2026-10-21T11:00:00+00:00",
    "last_forecast_time": "2026-10-23T06:00:00+00:00",
    "series_start": "2026-10-18T00:00:00+00:00",
    "model_run": "2026-10-21T03:00:00+00:00",
    "model_run_note": "meta.json last_run_initialisation_time, identique avant et après la requête",
    "grid_point": {
     "lat": 46.8,
     "lon": 5.449999,
     "elevation_m": 210.0,
     "distance_km": 0.43
    },
    "variables_requested": [
     "temperature_2m",
     "precipitation",
     "rain",
     "snowfall",
     "wind_speed_10m",
     "wind_gusts_10m",
     "relative_humidity_2m",
     "et0_fao_evapotranspiration",
     "surface_temperature"
    ],
    "variables_missing": [
     "rain",
     "snowfall",
     "et0_fao_evapotranspiration",
     "surface_temperature"
    ]
   },
   "arome": {
    "provider": "Météo-France",
    "model_name": "AROME France",
    "model_id": "meteofrance_arome_france",
    "kind": "deterministic",
    "endpoint": "https://api.open-meteo.com/v1/forecast",
    "region": "France",
    "nominal_resolution_km": 2.5,
    "role": "très court terme J0–J2, poids interprétatif renforcé",
    "forecast_horizon": {
     "nominal_hours": 48,
     "observed_hours_after_fetch": 43.4,
     "last_complete_local_day": "2026-10-22"
    },
    "fetched_at": "2026-10-21T10:34:42+00:00",
    "from_cache": false,
    "status": "FRESH",
    "status_reason": "horizon observé 43 h après la collecte ; non fournies par ce modèle : surface_temperature",
    "first_forecast_time": "2026-10-21T11:00:00+00:00",
    "last_forecast_time": "2026-10-23T06:00:00+00:00",
    "series_start": "2026-10-18T00:00:00+00:00",
    "model_run": "2026-10-21T03:00:00+00:00",
    "model_run_note": "meta.json last_run_initialisation_time, identique avant et après la requête",
    "grid_point": {
     "lat": 46.8,
     "lon": 5.450001,
     "elevation_m": 210.0,
     "distance_km": 0.43
    },
    "variables_requested": [
     "temperature_2m",
     "precipitation",
     "rain",
     "snowfall",
     "wind_speed_10m",
     "wind_gusts_10m",
     "relative_humidity_2m",
     "et0_fao_evapotranspiration",
     "surface_temperature"
    ],
    "variables_missing": [
     "surface_temperature"
    ]
   },
   "arpege": {
    "provider": "Météo-France",
    "model_name": "ARPEGE Europe",
    "model_id": "meteofrance_arpege_europe",
    "kind": "deterministic",
    "endpoint": "https://api.open-meteo.com/v1/forecast",
    "region": "Europe",
    "nominal_resolution_km": 11.0,
    "role": "court terme J0–J4",
    "forecast_horizon": {
     "nominal_hours": 96,
     "observed_hours_after_fetch": 97.4,
     "last_complete_local_day": "2026-10-24"
    },
    "fetched_at": "2026-10-21T10:34:42+00:00",
    "from_cache": false,
    "status": "FRESH",
    "status_reason": "horizon observé 97 h après la collecte ; non fournies par ce modèle : surface_temperature",
    "first_forecast_time": "2026-10-21T11:00:00+00:00",
    "last_forecast_time": "2026-10-25T12:00:00+00:00",
    "series_start": "2026-10-18T00:00:00+00:00",
    "model_run": "2026-10-21T06:00:00+00:00",
    "model_run_note": "meta.json last_run_initialisation_time, identique avant et après la requête",
    "grid_point": {
     "lat": 46.800003,
     "lon": 5.5,
     "elevation_m": 210.0,
     "distance_km": 3.82
    },
    "variables_requested": [
     "temperature_2m",
     "precipitation",
     "rain",
     "snowfall",
     "wind_speed_10m",
     "wind_gusts_10m",
     "relative_humidity_2m",
     "et0_fao_evapotranspiration",
     "surface_temperature"
    ],
    "variables_missing": [
     "surface_temperature"
    ]
   },
   "ecmwf": {
    "provider": "ECMWF",
    "model_name": "IFS HRES 9 km (grille native O1280)",
    "model_id": "ecmwf_ifs",
    "kind": "deterministic",
    "endpoint": "https://api.open-meteo.com/v1/forecast",
    "region": "Global (grille native 9 km)",
    "nominal_resolution_km": 9.0,
    "role": "contrôle indépendant J0–J7",
    "forecast_horizon": {
     "nominal_hours": 360,
     "observed_hours_after_fetch": 204.4,
     "last_complete_local_day": "2026-10-28"
    },
    "fetched_at": "2026-10-21T10:34:42+00:00",
    "from_cache": false,
    "status": "FRESH",
    "status_reason": "horizon observé 204 h après la collecte",
    "first_forecast_time": "2026-10-21T11:00:00+00:00",
    "last_forecast_time": "2026-10-29T23:00:00+00:00",
    "series_start": "2026-10-18T00:00:00+00:00",
    "model_run": "2026-10-21T00:00:00+00:00",
    "model_run_note": "meta.json last_run_initialisation_time, identique avant et après la requête",
    "grid_point": {
     "lat": 46.78383,
     "lon": 5.3796444,
     "elevation_m": 210.0,
     "distance_km": 5.81
    },
    "variables_requested": [
     "temperature_2m",
     "precipitation",
     "rain",
     "snowfall",
     "wind_speed_10m",
     "wind_gusts_10m",
     "relative_humidity_2m",